{"run":68,"commit":"51b85dc","metric":97.98,"metrics":{},"status":"discard","description":"Added dedicated alog/render background-thread branch test invoking DIFFED hook with __MAIN_THREAD__ false and __BACKGROUND__ true, but aggregate branch coverage remained 97.98%.","timestamp":1773653414416,"segment":1}
{"run":69,"commit":"51b85dc","metric":97.98,"metrics":{},"status":"discard","description":"Resume baseline run after context reset; benchmark and required checks passed, branch coverage unchanged at 97.98%.","timestamp":1773653512764,"segment":1}
{"run":70,"commit":"51b85dc","metric":97.98,"metrics":{},"status":"discard","description":"Added worklet/ref branch test for __LEPUS__ && __DEV__ getter/setter throws on MainThreadRef.current, but aggregate branch coverage remained unchanged at 97.98%.","timestamp":1773653637121,"segment":1}
{"run":71,"commit":"a7afe50","metric":98.06,"metrics":{},"status":"keep","description":"Added focused hydrate list-branch test using synthetic snapshots to cover ListChildren path where a hydrated list item's id is absent from signMap (`if (signMap.has(listItemID))` false branch). Branch coverage improved to 98.06% with checks passing.","timestamp":1773653884420,"segment":1}
{"run":72,"commit":"fee080e","metric":98.14,"metrics":{},"status":"keep","description":"Added lazy-bundle background-thread test for `code===0` with missing dynamic exports (`getDynamicComponentExports` returns undefined), covering the false branch of `if (exports)` before rejection. Branch coverage improved to 98.14% with checks passing.","timestamp":1773653992988,"segment":1}
{"run":73,"commit":"79ba436","metric":98.23,"metrics":{},"status":"keep","description":"Added snapshot module-initialization branch test that resets modules and imports snapshot with __JS__ disabled in __DEV__, verifying snapshotCreatorMap is not proxied (no DEV_ONLY_AddSnapshot patch emitted). Branch coverage improved to 98.23% with checks passing.","timestamp":1773654100998,"segment":1}
{"run":74,"commit":"79ba436","metric":98.23,"metrics":{},"status":"discard","description":"Resume baseline after context reset: benchmark and required checks passed; branch coverage unchanged at 98.23%.","timestamp":1773654171234,"segment":1}
{"run":75,"commit":"6dfb7a0","metric":98.31,"metrics":{},"status":"keep","description":"Added lifecycle/updateMainThread branch test for __ALOG__ disabled mode, asserting BTS->MTS debug alog output is skipped. Covered false branch of `if (typeof __ALOG__ !== 'undefined' && __ALOG__)`. Branch coverage improved to 98.31% with checks passing.","timestamp":1773654268048,"segment":1}
